{
  "$schema": "https://json-schema.org/draft/2020-12/schema",
  "$id": "gkd://schema/task/task-state-v1",
  "type": "object",
  "additionalProperties": false,
  "required": ["schemaVersion", "taskId", "revision", "repository", "documents", "approval", "implementationAuthorization", "actionAuthorizationDigest", "lifecycle", "history", "integrityDigest"],
  "properties": {
    "schemaVersion": {"const": 1},
    "taskId": {"type": "string", "minLength": 1},
    "revision": {"type": "integer", "minimum": 0},
    "repository": {"$ref": "#/$defs/repository"},
    "documents": {"$ref": "#/$defs/documents"},
    "approval": {"type": ["object", "null"]},
    "implementationAuthorization": {"type": ["object", "null"]},
    "actionAuthorizationDigest": {"type": ["string", "null"], "pattern": "^[0-9a-f]{64}$"},
    "lifecycle": {"$ref": "#/$defs/lifecycle"},
    "history": {"type": "array", "items": {"$ref": "#/$defs/event"}},
    "integrityDigest": {"$ref": "#/$defs/sha256"}
  },
  "$defs": {
    "sha1": {"type": "string", "pattern": "^[0-9a-f]{40}$"},
    "sha256": {"type": "string", "pattern": "^[0-9a-f]{64}$"},
    "repository": {
      "type": "object",
      "additionalProperties": false,
      "required": ["identity", "baseBranch", "baseSha", "taskBranch", "taskPath"],
      "properties": {
        "identity": {"type": "string"},
        "baseBranch": {"type": "string"},
        "baseSha": {"$ref": "#/$defs/sha1"},
        "taskBranch": {"type": "string"},
        "taskPath": {"type": "string"}
      }
    },
    "documents": {
      "type": "object",
      "additionalProperties": false,
      "required": ["requirements", "plan", "implementation"],
      "properties": {
        "requirements": {"type": "object", "additionalProperties": false, "required": ["path", "version", "documentRevision", "digest", "status"], "properties": {"path": {"type": "string"}, "version": {"type": "integer", "minimum": 1}, "documentRevision": {"type": "integer", "minimum": 1}, "digest": {"$ref": "#/$defs/sha256"}, "status": {"enum": ["draft", "ready"]}}},
        "plan": {"type": "object", "additionalProperties": false, "required": ["path", "version", "documentRevision", "digest", "materialDigest", "status"], "properties": {"path": {"type": "string"}, "version": {"type": "integer", "minimum": 1}, "documentRevision": {"type": "integer", "minimum": 1}, "digest": {"$ref": "#/$defs/sha256"}, "materialDigest": {"$ref": "#/$defs/sha256"}, "status": {"enum": ["proposed", "approved"]}}},
        "implementation": {"type": "object", "additionalProperties": false, "required": ["path", "version", "documentRevision", "digest"], "properties": {"path": {"type": "string"}, "version": {"type": "integer", "minimum": 1}, "documentRevision": {"type": "integer", "minimum": 1}, "digest": {"$ref": "#/$defs/sha256"}}}
      }
    },
    "lifecycle": {
      "type": "object",
      "additionalProperties": false,
      "required": ["phase", "epoch", "blocked", "writer", "offer", "claim", "retiredClaims", "delivery", "acceptance", "completion"],
      "properties": {
        "phase": {"enum": ["planning", "awaiting_claim", "implementing", "delivered", "accepted", "completed"]},
        "epoch": {"type": "integer", "minimum": 0},
        "blocked": {"type": ["object", "null"]},
        "writer": {"type": ["object", "null"]},
        "offer": {"type": ["object", "null"]},
        "claim": {"type": ["object", "null"]},
        "retiredClaims": {"type": "array"},
        "delivery": {"type": ["object", "null"]},
        "acceptance": {"type": ["object", "null"]},
        "completion": {"type": ["object", "null"]}
      },
      "allOf": [
        {"if": {"properties": {"phase": {"const": "planning"}}}, "then": {"properties": {"writer": {"type": "null"}, "offer": {"type": "null"}, "claim": {"type": "null"}, "delivery": {"type": "null"}, "acceptance": {"type": "null"}, "completion": {"type": "null"}}}},
        {"if": {"properties": {"phase": {"const": "awaiting_claim"}}}, "then": {"properties": {"writer": {"type": "null"}, "offer": {"type": "object"}, "claim": {"type": "null"}, "delivery": {"type": "null"}, "acceptance": {"type": "null"}, "completion": {"type": "null"}}}},
        {"if": {"properties": {"phase": {"const": "implementing"}}}, "then": {"properties": {"writer": {"type": "object"}, "offer": {"type": "object"}, "claim": {"type": "object"}, "delivery": {"type": "null"}, "acceptance": {"type": "null"}, "completion": {"type": "null"}}}},
        {"if": {"properties": {"phase": {"const": "delivered"}}}, "then": {"properties": {"writer": {"type": "null"}, "offer": {"type": "object"}, "claim": {"type": "object"}, "delivery": {"type": "object"}, "acceptance": {"type": "null"}, "completion": {"type": "null"}}}},
        {"if": {"properties": {"phase": {"const": "accepted"}}}, "then": {"properties": {"writer": {"type": "null"}, "offer": {"type": "object"}, "claim": {"type": "object"}, "delivery": {"type": "object"}, "acceptance": {"type": "object"}, "completion": {"type": "null"}}}},
        {"if": {"properties": {"phase": {"const": "completed"}}}, "then": {"properties": {"writer": {"type": "null"}, "offer": {"type": "object"}, "claim": {"type": "object"}, "delivery": {"type": "object"}, "acceptance": {"type": "object"}, "completion": {"type": "object"}}}}
      ]
    },
    "event": {
      "type": "object",
      "additionalProperties": false,
      "required": ["revision", "type", "at", "head", "recordDigest"],
      "properties": {"revision": {"type": "integer", "minimum": 0}, "type": {"type": "string"}, "at": {"type": "string"}, "head": {"anyOf": [{"$ref": "#/$defs/sha1"}, {"type": "null"}]}, "recordDigest": {"$ref": "#/$defs/sha256"}}
    }
  }
}
