{"actionAuthorizationDigest":"d42a3d028f2f3a4424571676fa23b1ba9b892dab7f88cd7893eafc26df038d42","approval":{"approvedAt":"2026-08-21T19:19:53Z","decisionRef":"frozen-plan-m4-a","materialDigest":"a41a0f8b8b7d07fc45f87afabd71ca30182f0f2c0d01094c6b05c11bc75e03d9","planVersion":1},"documents":{"implementation":{"digest":"92bb55a0d2f13940031ef347e118fa2d3672aeee62a258d2bbeeb27de5eb434f","documentRevision":2,"path":"implementation.md","version":2},"plan":{"digest":"c9c1976b5c63304fc045bebe4c6d8230e5394b7f88a4fe200afcccb2deb744ab","documentRevision":2,"materialDigest":"a41a0f8b8b7d07fc45f87afabd71ca30182f0f2c0d01094c6b05c11bc75e03d9","path":"plan.md","status":"approved","version":1},"requirements":{"digest":"d984ce4ed9a135601f188e719be448e79ffdcccb2a251368aff78b2616ff2de0","documentRevision":1,"path":"requirements.md","status":"ready","version":1}},"history":[{"at":"2026-08-21T19:19:25Z","head":"a1dad775ee9d652203ab18efb1378362772dcc4a","recordDigest":"5878ec1698a810bdd600792ac1a474f78ca2d590accbdf4402738eba3d364086","revision":0,"type":"bootstrap"},{"at":"2026-08-21T19:19:37Z","head":"c3ca36a7f365977d24528a477fbc575fc2450ba0","recordDigest":"c2014a07e5a162f61656f1ecd16537f75b3c5dd770308f548f090c8f93c5a487","revision":1,"type":"requirements_ready"},{"at":"2026-08-21T19:19:45Z","head":"5cce18c1172ee9331e8ea841af45c07447a0bb7e","recordDigest":"5896f7a35e78ea39c47be5ae3f575baa38639e5be5163c3431ddc24b7aeb6f5d","revision":2,"type":"plan_proposed"},{"at":"2026-08-21T19:19:53Z","head":"31e4106a17bbe2fabaf621c8b6fa180a9c0bfd30","recordDigest":"dc8294540aa807d367379e926f67949c083c43cb05d0a3cc4078627b9cf69cd4","revision":3,"type":"plan_approved"}],"implementationAuthorization":{"authorizedAt":"2026-08-21T19:19:53Z","decisionRef":"frozen-plan-m4-a","materialDigest":"a41a0f8b8b7d07fc45f87afabd71ca30182f0f2c0d01094c6b05c11bc75e03d9","planVersion":1},"integrityDigest":"03e9d808b70d8f64964ead9a8554e324ca7a56ecc0b7cefe23e1a0f9fcdf6afa","lifecycle":{"acceptance":null,"blocked":null,"claim":null,"completion":null,"delivery":null,"epoch":0,"offer":null,"phase":"planning","retiredClaims":[],"writer":null},"repository":{"baseBranch":"main","baseSha":"a1dad775ee9d652203ab18efb1378362772dcc4a","identity":"github.com/KNaiFen/gkd","taskBranch":"task/m4-finalization-release","taskPath":"tasks/m4-finalization-release"},"revision":3,"schemaVersion":1,"taskId":"GKD-M4-A"}
