{"actionAuthorizationDigest":"8521b346a22c03d46a6b53aebd037110032b4b0660db0fb06978c0cad42cfb9a","approval":{"approvedAt":"2026-08-20T17:36:46Z","decisionRef":"user/continuous-gkd-m3-m4-m5/2026-08-21/GKD-M2-H","materialDigest":"3ef55130f67faa194101d65c38536fef177cdae765fe706f2f82aa60dd328666","planVersion":1},"documents":{"implementation":{"digest":"f6af81121064499d52e054ae4cc5d014b859f15bdc6163d4af2e823af736efac","documentRevision":1,"path":"implementation.md","version":1},"plan":{"digest":"73ec59b130db44efade31067b170d209f24fa70faee085225e21579a4a373306","documentRevision":1,"materialDigest":"3ef55130f67faa194101d65c38536fef177cdae765fe706f2f82aa60dd328666","path":"plan.md","status":"approved","version":1},"requirements":{"digest":"2a9a5e7ed1238612e2b51783718c82ee1255cf27e264b1878cea39cf777593a3","documentRevision":1,"path":"requirements.md","status":"ready","version":1}},"history":[{"at":"2026-08-20T17:36:10Z","head":"6b5d5b78a3c5f5cc98d0659167b5d3838d14f518","recordDigest":"2d5f95ff19d5f6411ecbb391ac76ff6040e01f37213ea1f6d7ade9e6b865be9f","revision":0,"type":"bootstrap"},{"at":"2026-08-20T17:36:32Z","head":"05ead37c3ba827d5cd68c4ead99c4836b4a74708","recordDigest":"b74fc474b4596079ef9c444c46a6e44c6f5d2cd0c243e4b103c450f300247cbd","revision":1,"type":"requirements_ready"},{"at":"2026-08-20T17:36:46Z","head":"74d5c15c85e845698a5d0a066afac3a37d14cd0e","recordDigest":"d2b7da67a8cd851c2863ee07c92f8f0c65dbd392054ea095c72be0a06bebed7f","revision":2,"type":"plan_approved"},{"at":"2026-08-20T17:37:50Z","head":"3804731f697ad18427569dce3c8db1cc9514fb42","recordDigest":"551e85f2ab8cde95c778e63485e6a486a9efe398fdd2ddd8775a759b6c4fe9c1","revision":3,"type":"offer_created"},{"at":"2026-08-20T17:40:21Z","head":"17590792e45b3593459ec8a5c751b65caff822eb","recordDigest":"e99d69cb9c3003d4dfc539918e6d001d2308e08e7a2af50a9fb533f3f5f851e0","revision":4,"type":"revoked"}],"implementationAuthorization":{"authorizedAt":"2026-08-20T17:36:46Z","decisionRef":"user/continuous-gkd-m3-m4-m5/2026-08-21/GKD-M2-H","materialDigest":"3ef55130f67faa194101d65c38536fef177cdae765fe706f2f82aa60dd328666","planVersion":1},"integrityDigest":"2f29fd5a2923cfe247e6c0d7f5a979995ee178a2a658c7fdeb90c337ea71df15","lifecycle":{"acceptance":null,"blocked":null,"claim":null,"completion":null,"delivery":null,"epoch":1,"offer":null,"phase":"planning","retiredClaims":[{"claim":null,"epoch":0,"offerId":"8408e3ac096e08bb9e091b638e6d8dfa3275576065a95cfeb6930c9eed74d2e7","reason":"executor-no-wait-tool-preclaim-end","retiredAt":"2026-08-20T17:40:21Z"}],"writer":null},"repository":{"baseBranch":"main","baseSha":"6b5d5b78a3c5f5cc98d0659167b5d3838d14f518","identity":"github.com/KNaiFen/gkd","taskBranch":"task/m2-host-recovery-bridge-reopen","taskPath":"tasks/m2-host-recovery-bridge-reopen"},"revision":4,"schemaVersion":1,"taskId":"GKD-M2-H"}
