{"actionAuthorizationDigest":"fbfd026a5f2950bdc01d5bf9c66d4f0c7054f8edbfde13cd78d708cd53538a91","approval":{"approvedAt":"2026-08-22T04:15:24Z","decisionRef":"frozen-plan-m5-b-final-live-gate-remediation","materialDigest":"5ef8f8ef78b3f90bc9f0740f989abd8287b3f6698adf9c0762d24e29592b833e","planVersion":1},"documents":{"implementation":{"digest":"f411ca4f1935a4f140d4669efee449e68b88f90575fd4bb4d35c15bf736a5d29","documentRevision":2,"path":"implementation.md","version":2},"plan":{"digest":"67769fe766d72b2ac5184964bc7e1eaa6e0b800281236c318a98b6d4ef5072e3","documentRevision":2,"materialDigest":"5ef8f8ef78b3f90bc9f0740f989abd8287b3f6698adf9c0762d24e29592b833e","path":"plan.md","status":"approved","version":1},"requirements":{"digest":"e64a5d65abfe7e2071b913b8f5fd805311ec7250f61c0c942e94db1b980f86b2","documentRevision":1,"path":"requirements.md","status":"ready","version":1}},"history":[{"at":"2026-08-22T04:14:37Z","head":"3f0a60feaa724e37163d207678917f140312cfdc","recordDigest":"007dbc3126b90405bff800b7956d394a89af51a58d78c15bb3b14084689f442d","revision":0,"type":"bootstrap"},{"at":"2026-08-22T04:14:57Z","head":"5be3233cbee38355799ce957cfc3b7c7e933367b","recordDigest":"3a7da3ef6d95ecf82f17eadc0e5c348fac867e94688a4c333613f0bc4d4fdd95","revision":1,"type":"requirements_ready"},{"at":"2026-08-22T04:15:10Z","head":"8708ad4041bd046daa24c4b03a9571f06393d952","recordDigest":"f870a8f9080c447c1bfca6f92ad1a345cdb8e7f47cbf38e77623b0410156cef7","revision":2,"type":"plan_proposed"},{"at":"2026-08-22T04:15:24Z","head":"83d277ab39338f24907ca756e90f657914754285","recordDigest":"7979b6151d6be0d91b2267b1e9b896eaad16995efc40cc10d04b228705692221","revision":3,"type":"plan_approved"},{"at":"2026-08-22T04:15:41Z","head":"78cde775c7f7de2f0397ae2e95f7e761431512be","recordDigest":"4b87fb6e7bf99d238eb19d79040586d2a4db9b4161818f2cad00cb566b1aca7d","revision":4,"type":"offer_created"},{"at":"2026-08-22T04:16:19Z","head":"305614b66696b86bd79058bfa5fa045d2bb8e928","recordDigest":"3be341026edbc4bc1efca67dcd0ebd4dcef181d034f13b1db33d6da67546d5c5","revision":5,"type":"claimed"}],"implementationAuthorization":{"authorizedAt":"2026-08-22T04:15:24Z","decisionRef":"frozen-plan-m5-b-final-live-gate-remediation","materialDigest":"5ef8f8ef78b3f90bc9f0740f989abd8287b3f6698adf9c0762d24e29592b833e","planVersion":1},"integrityDigest":"4c33ea020253a5f74bb3452e9ba2ca22ed42052400c99af38bac84d9425e0b3a","lifecycle":{"acceptance":null,"blocked":null,"claim":{"activationId":"870f5ab7b345f985467bbf1ac9cb2298d29bb33ef719bf4d55f12cd812e5ced7","claimBaseHead":"305614b66696b86bd79058bfa5fa045d2bb8e928","claimId":"3612cbc5de8d3911c380ccbb96d22d8e614215ff72616a2c0884f44b1686f173","claimedAt":"2026-08-22T04:16:19Z","configDigest":"d44d2286d0a01a7b0f82610c02a6ada9fb1dc74f05730b1e8629f784d68595d2","envelopeId":"4de6496ab83ba2d6df82d062e6dcc7ef0c2129932de944147fb811fb9a96ef3e","epoch":0,"executionBundleDigest":"27470fc60cfa005a2784ac81f0aba07c4e50e2381bf057fe9b38aa8d016e1912","offerId":"b72917fcfd6a665fee1102312d32fa266edddcdc2172fd3963cd75b549afe129","roleDigest":"b7660cee9bdab5b1011ae9e92a2a817536f508ef1475a10cc53acd9a1d99c25b","routeDecisionDigest":"a298f65210f9b163633bb3043491231020a2f3754d0ea2285e1e859c87ce01a4","sessionDigest":"25bc5f6ae83f54b3c1c99c3e24bd71a51e14a2ab1e183db4e37099ffcbeb8a62","writerId":"gkd_executor_gkd_m5_b_87ca4dab878fbaaa00bfde7e222e83aad464a83f7cd6ac2887ac2e7d6cd26dd8"},"completion":null,"delivery":null,"epoch":0,"offer":{"authorizationDigest":"fbfd026a5f2950bdc01d5bf9c66d4f0c7054f8edbfde13cd78d708cd53538a91","epoch":0,"offerId":"b72917fcfd6a665fee1102312d32fa266edddcdc2172fd3963cd75b549afe129"},"phase":"implementing","retiredClaims":[],"writer":{"claimId":"3612cbc5de8d3911c380ccbb96d22d8e614215ff72616a2c0884f44b1686f173","sessionDigest":"25bc5f6ae83f54b3c1c99c3e24bd71a51e14a2ab1e183db4e37099ffcbeb8a62","writerId":"gkd_executor_gkd_m5_b_87ca4dab878fbaaa00bfde7e222e83aad464a83f7cd6ac2887ac2e7d6cd26dd8"}},"repository":{"baseBranch":"main","baseSha":"3f0a60feaa724e37163d207678917f140312cfdc","identity":"github.com/KNaiFen/gkd","taskBranch":"task/m5-final-live-gate","taskPath":"tasks/m5-final-live-gate"},"revision":5,"schemaVersion":1,"taskId":"GKD-M5-B"}
