{"actionAuthorizationDigest":null,"approval":null,"documents":{"implementation":{"digest":"bd7b8523fae663bf6e24098081bf529a41a01748d4b2ab55c50386fb65270585","documentRevision":1,"path":"implementation.md","version":1},"plan":{"digest":"11b8bb5bd786937e152e4561935d3a83251ee9d52920ade17f099cc9a7614c15","documentRevision":1,"materialDigest":"b5bad1ebdaa4d0164446eef95ab7e6c60be3e75fbd3f916bb8795dc15fb9096b","path":"plan.md","status":"proposed","version":1},"requirements":{"digest":"e8156b80fa0735ef80f182ea2eb4fbf526e08333d8dc9f669368868a969267e8","documentRevision":1,"path":"requirements.md","status":"ready","version":1}},"history":[{"at":"2026-08-20T13:14:41Z","head":"5cc7f6bbc61c2a06ecdf2104a6e7cd3129f23959","recordDigest":"5cde4db9f490e2a0854786ec5c9d7f4f42613d4637ab460b21175c3e0c5a6e49","revision":0,"type":"bootstrap"},{"at":"2026-08-20T13:14:53Z","head":"01c077fdddb3fb59589c30ea0606394a59b202eb","recordDigest":"74a9fe4acbe30af61dce382a4b70f0b4c29c195c88eb42e59d8542c4a06ccc27","revision":1,"type":"requirements_ready"}],"implementationAuthorization":null,"integrityDigest":"200e0f500ea414e8a86f85466532229d20e4b6768f6a867630441fa00f2d5721","lifecycle":{"acceptance":null,"blocked":null,"claim":null,"completion":null,"delivery":null,"epoch":0,"offer":null,"phase":"planning","retiredClaims":[],"writer":null},"repository":{"baseBranch":"main","baseSha":"5cc7f6bbc61c2a06ecdf2104a6e7cd3129f23959","identity":"github.com/KNaiFen/gkd","taskBranch":"task/m2-delivered-rework-core","taskPath":"tasks/m2-delivered-rework-core"},"revision":1,"schemaVersion":1,"taskId":"GKD-M2-D"}
