{"actionAuthorizationDigest":null,"approval":null,"documents":{"implementation":{"digest":"ad513301325c0fc3847af811ead27d3d2e8fb0eb8b73421676729aa0f561dab5","documentRevision":2,"path":"implementation.md","version":2},"plan":{"digest":"6a4eb8cfe9bf215b9c9f448618dece16df9d41a8ad0b3564e9d60b403e8ea179","documentRevision":2,"materialDigest":"8c7901f2b1741f6651c2aec47472c417af7c4a919912425cff3c757257364570","path":"plan.md","status":"proposed","version":1},"requirements":{"digest":"7ef5503bb6780c378e3d587a7d9d80dbcc7ac223c4e570d79d404b62a76e4492","documentRevision":1,"path":"requirements.md","status":"ready","version":1}},"history":[{"at":"2026-08-20T19:43:08Z","head":"c2ae190f96ca321b1b5fe83035f8c67b4c20a42c","recordDigest":"238d65f10f10e4a490297828202b7abd576adcc340c6f6abeb143d39c810462a","revision":0,"type":"bootstrap"},{"at":"2026-08-20T19:43:25Z","head":"f9a9c4d62459d06f8fceb8c50cb92c167fd095dc","recordDigest":"4de703c6e52433d54c775205e6b2aeb9b037703de9cc72fb65c54eb85a6ab885","revision":1,"type":"requirements_ready"},{"at":"2026-08-20T19:43:40Z","head":"eb341dcddfe9ca0f5ca5bdf74684c340fefdced3","recordDigest":"110c038d2018504a04f634e1e62bf36e5aa4b27a59c26e01a2803ff9eb609c72","revision":2,"type":"plan_proposed"}],"implementationAuthorization":null,"integrityDigest":"2f1a3529d7c16cda4f44665e82b20691e8a36bca947db43ea09b76c68c877732","lifecycle":{"acceptance":null,"blocked":null,"claim":null,"completion":null,"delivery":null,"epoch":0,"offer":null,"phase":"planning","retiredClaims":[],"writer":null},"repository":{"baseBranch":"main","baseSha":"c2ae190f96ca321b1b5fe83035f8c67b4c20a42c","identity":"github.com/KNaiFen/gkd","taskBranch":"task/m2-host-recovery-bridge-redelivery","taskPath":"tasks/m2-host-recovery-bridge-redelivery"},"revision":2,"schemaVersion":1,"taskId":"GKD-M2-I-R"}
