{"actionAuthorizationDigest":"84c49f24fb01edbfd9bb11f3a8f9fdea7547d39a8e364ecf7dce88380d3f80fa","approval":{"approvedAt":"2026-08-19T18:53:17Z","decisionRef":"user-2026-08-20-proceed-roadmap","materialDigest":"59a4e08b5209c324f10feeee258ddae4fb2a273647f4f5ea60b1d27cf1c4c395","planVersion":1},"documents":{"implementation":{"digest":"f0506563c8947faa465f78202bbdd23b45b59ed6ce0bc7e1916569abc1ae397b","documentRevision":1,"path":"implementation.md","version":1},"plan":{"digest":"c7d27532b7ae6e067c57cb80c63a7b8c695b3b12e267a70d119e8ca0667750c4","documentRevision":1,"materialDigest":"59a4e08b5209c324f10feeee258ddae4fb2a273647f4f5ea60b1d27cf1c4c395","path":"plan.md","status":"approved","version":1},"requirements":{"digest":"ac202df74284b6dd6e6ed668b7c7bb3896b8c5edaa0fb48c856228b95c551f8c","documentRevision":1,"path":"requirements.md","status":"ready","version":1}},"history":[{"at":"2026-08-19T18:51:38Z","head":"302f60d96c2f81e85052025f814593015a436bd7","recordDigest":"34949b4aadbd09c0eb372736e92ca9bdb012ef725cd4f3096c6f79c9dfd59fe8","revision":0,"type":"bootstrap"},{"at":"2026-08-19T18:53:07Z","head":"6a5701f30cd52f7164d6eda21b02339109bdb43c","recordDigest":"87fe0c49d4cee101ff000b998bd02e7aed3e778796934dd34cf7f6d182d83190","revision":1,"type":"requirements_ready"},{"at":"2026-08-19T18:53:17Z","head":"21e4e138624342c0fba3feded20271f339ce655a","recordDigest":"5f354e5c5f61cf9749adb1c7224dc2448e47738f04e35b3183a7bf1d085b8760","revision":2,"type":"plan_approved"},{"at":"2026-08-19T18:53:30Z","head":"1b9ada575a7930df5bab3a8ca33b4f46e3e69e4c","recordDigest":"cd22e87c69a07a8f000af3f653286a6c1df857ecb9463933204d0bc2b57da37a","revision":3,"type":"authorized"}],"implementationAuthorization":{"authorizedAt":"2026-08-19T18:53:30Z","decisionRef":"user-2026-08-20-proceed-roadmap","materialDigest":"59a4e08b5209c324f10feeee258ddae4fb2a273647f4f5ea60b1d27cf1c4c395","planVersion":1},"integrityDigest":"382200ad1a5cef42ef05cb2f9b0409975be24b20663052af434991bcfe9e2c16","lifecycle":{"acceptance":null,"blocked":null,"claim":null,"completion":null,"delivery":null,"epoch":0,"offer":null,"phase":"planning","retiredClaims":[],"writer":null},"repository":{"baseBranch":"main","baseSha":"302f60d96c2f81e85052025f814593015a436bd7","identity":"github.com/KNaiFen/gkd","taskBranch":"task/m2-automatic-runtime-bridge","taskPath":"tasks/m2-automatic-runtime-bridge"},"revision":3,"schemaVersion":1,"taskId":"GKD-M2-C"}
