{"actionAuthorizationDigest":"fd8fff4ead218ad2803f76aa9be82567a5eaf9d6c3289e821ee24b9656936878","approval":{"approvedAt":"2026-08-23T03:10:12Z","decisionRef":"2026-08-23-user-r4-authorization","materialDigest":"ade89e84fe1e538d35f99c38e820099990822919e8bb3824316e25dd3edd9ddc","planVersion":1},"documents":{"implementation":{"digest":"e3b8d2953ff85734fa4e05bd534b078126ee6df17cdf15b2311bd0d666448ff3","documentRevision":2,"path":"implementation.md","version":2},"plan":{"digest":"c52f21067ac5420680fe68b8812a6ca893e8986349420ed3e9d6c5d36a0ee280","documentRevision":2,"materialDigest":"ade89e84fe1e538d35f99c38e820099990822919e8bb3824316e25dd3edd9ddc","path":"plan.md","status":"approved","version":1},"requirements":{"digest":"52686d7723bf876b4c9450a6135199206eebed771ebfe901fe24b63508d092f8","documentRevision":1,"path":"requirements.md","status":"ready","version":1}},"history":[{"at":"2026-08-23T03:08:28Z","head":"3133e35df8dd520e2976116e6468761eef6d84df","recordDigest":"d2b3daed19ff9474e1af540878750d4a8389019ad4217ef1fd12688f1f006d31","revision":0,"type":"bootstrap"},{"at":"2026-08-23T03:09:20Z","head":"27d19bcce44af7e9d027cac2cb75f9fc624efb19","recordDigest":"c91c33e179beb84ae351a9c400bcaaa7f8e8185ee78ffae35055e7d3ee46e1ab","revision":1,"type":"requirements_ready"},{"at":"2026-08-23T03:09:52Z","head":"cf9779ab3e3e5eb325435ff382a0b507f26ef3d9","recordDigest":"c11adefac34057cbddd9e37977e2b3f707a99ebecfe79337bcf519d2dae951db","revision":2,"type":"plan_proposed"},{"at":"2026-08-23T03:10:12Z","head":"47101f166f1781c32cde569c3dc9cd85542ec86e","recordDigest":"c6f80684f2f5eaca0f91208ef908cd48525ed9b5ee2b15dd1cc5bec171796c4d","revision":3,"type":"plan_approved"}],"implementationAuthorization":{"authorizedAt":"2026-08-23T03:10:12Z","decisionRef":"2026-08-23-user-r4-authorization","materialDigest":"ade89e84fe1e538d35f99c38e820099990822919e8bb3824316e25dd3edd9ddc","planVersion":1},"integrityDigest":"ea5cf8f2538e3238440b2738e121693070e7769d61e1922a4d971388637f824b","lifecycle":{"acceptance":null,"blocked":null,"claim":null,"completion":null,"delivery":null,"epoch":0,"offer":null,"phase":"planning","retiredClaims":[],"writer":null},"repository":{"baseBranch":"main","baseSha":"3133e35df8dd520e2976116e6468761eef6d84df","identity":"github.com/KNaiFen/gkd","taskBranch":"task/r4-release-policy-binding","taskPath":"tasks/r4-release-policy-binding"},"revision":3,"schemaVersion":1,"taskId":"GKD-R4"}
