{"actionAuthorizationDigest":"32017c6889bb0a55e2e676145df6ee09b4dd2fbca2749b0aa05f65148b2d8163","approval":{"approvedAt":"2026-08-20T14:47:41Z","decisionRef":"user/continuous-gkd-m3-m4-m5/2026-08-20/GKD-M2-E","materialDigest":"6f1b66dcc908e8d029534b749ac45a91a115cdb88b658d50926bb5493d8d4bd1","planVersion":1},"documents":{"implementation":{"digest":"ae2847cc6cc0a9371c4ef24b9536a879b635e0eeccef891a44b0378d6850f34b","documentRevision":1,"path":"implementation.md","version":1},"plan":{"digest":"52b162806d84e11f09e9d7169518ddafa483794a5968f6c569f723040ede452f","documentRevision":1,"materialDigest":"6f1b66dcc908e8d029534b749ac45a91a115cdb88b658d50926bb5493d8d4bd1","path":"plan.md","status":"approved","version":1},"requirements":{"digest":"9de96f277b59d94802bf2342dc5801d68ffa8ee254595cb53e545327293801a8","documentRevision":1,"path":"requirements.md","status":"ready","version":1}},"history":[{"at":"2026-08-20T14:47:18Z","head":"6b5d5b78a3c5f5cc98d0659167b5d3838d14f518","recordDigest":"7045018dc6852d606857566b615d17cd778d662d255804f8180526caa077c6f1","revision":0,"type":"bootstrap"},{"at":"2026-08-20T14:47:29Z","head":"cf8aa4b201107544dad5f8f76b0ff8299975bd6e","recordDigest":"95147db49c2275cf5efcd543fb3b3858ba5aae3997ab36e75f31c09931fcb24d","revision":1,"type":"requirements_ready"},{"at":"2026-08-20T14:47:41Z","head":"5d5cfcd87e1de7167fb4ba8a9f1450403fb09656","recordDigest":"f591f149662f02edc8d67f5ba1e8a3dd9676101c7de524351792dc5ac3b51eac","revision":2,"type":"plan_approved"},{"at":"2026-08-20T14:48:39Z","head":"04eb11e0fcfeeba292d565a4af36608aa27a34ff","recordDigest":"cda57faa074a5d153cf79acf4d7f67375299701ed0ef01a9902904d0eadd25bf","revision":3,"type":"offer_created"},{"at":"2026-08-20T14:50:40Z","head":"cbadece7f5d8e0a594320f846a11e3a2d12cd1b6","recordDigest":"ef5a9c3d518b9d2874e8ea597400d8d74f78f2adf3adf7e7d0470333bdccf410","revision":4,"type":"claimed"}],"implementationAuthorization":{"authorizedAt":"2026-08-20T14:47:41Z","decisionRef":"user/continuous-gkd-m3-m4-m5/2026-08-20/GKD-M2-E","materialDigest":"6f1b66dcc908e8d029534b749ac45a91a115cdb88b658d50926bb5493d8d4bd1","planVersion":1},"integrityDigest":"a37eabe0c932cfc88dc1020d6ed04b7260e4522e96ebefbe9487db25ad91a0f3","lifecycle":{"acceptance":null,"blocked":null,"claim":{"activationId":"080dfa2e415a4f1a16aef46988d153b43d1451055ce7c8b56c4f14feb7b01a89","claimBaseHead":"cbadece7f5d8e0a594320f846a11e3a2d12cd1b6","claimId":"80587b15c9f18548594a8ccb563af76c0f985e6512441ae9bfaedd1cb0f0b6c8","claimedAt":"2026-08-20T14:50:40Z","configDigest":"10c0675808974609242280367f2e7aea07e61dd839a1ec2e244d53a9b6c74e3e","envelopeId":"f61d079751088b43f21998ce570206ac66f23a417cb1da96a97b85bbcde80c37","epoch":0,"executionBundleDigest":"71c4b2d3562c2e5a6a784bf3436a7d5920cd00b3ad387f320a2563d4b5b88766","offerId":"4b782bc7e522d32a1c78bba4cc713e89bd8213ce6170306e41dcce9249904eef","roleDigest":"880e1855cfdeb50ba890a3023c818cde377b9c6a71c230360154b79ecc16d680","routeDecisionDigest":"d59c534b01d1617b20b8086b0686bfb09d3ef9999982fd86910ca3402974c75d","sessionDigest":"9ba186fbe0999ab524ce7c4bbdab7bb6160462a0146e1394e83f9e3c1c5f67bd","writerId":"gkd_executor_gkd_m2_e"},"completion":null,"delivery":null,"epoch":0,"offer":{"authorizationDigest":"32017c6889bb0a55e2e676145df6ee09b4dd2fbca2749b0aa05f65148b2d8163","epoch":0,"offerId":"4b782bc7e522d32a1c78bba4cc713e89bd8213ce6170306e41dcce9249904eef"},"phase":"implementing","retiredClaims":[],"writer":{"claimId":"80587b15c9f18548594a8ccb563af76c0f985e6512441ae9bfaedd1cb0f0b6c8","sessionDigest":"9ba186fbe0999ab524ce7c4bbdab7bb6160462a0146e1394e83f9e3c1c5f67bd","writerId":"gkd_executor_gkd_m2_e"}},"repository":{"baseBranch":"main","baseSha":"6b5d5b78a3c5f5cc98d0659167b5d3838d14f518","identity":"github.com/KNaiFen/gkd","taskBranch":"task/m2-epoch-aware-spawn-name","taskPath":"tasks/m2-epoch-aware-spawn-name"},"revision":4,"schemaVersion":1,"taskId":"GKD-M2-E"}
