{"actionAuthorizationDigest":null,"approval":null,"documents":{"implementation":{"digest":"81d5b419d2ef431b0c785a8026eff47e634ad59d7bd137055520215ff9521626","documentRevision":1,"path":"implementation.md","version":1},"plan":{"digest":"95005b8beb79415106c824a613f7efcafefb3ee822c6fd66d40dba1dfef4bf23","documentRevision":1,"materialDigest":"d473afc659e3128d26370466f2923f284636b2546dba14723ed32c4cd6a5eb8b","path":"plan.md","status":"proposed","version":1},"requirements":{"digest":"269eb879d5b7574e751b083289e4aaa1a329e9639560a044d530722ca3daa2e7","documentRevision":1,"path":"requirements.md","status":"ready","version":1}},"history":[{"at":"2026-08-22T19:09:28Z","head":"d5f1eef459eb1598e48c9d61135d9ec7a6b10e48","recordDigest":"6f3166a6821b5ece5d285e3b9bdf56b5b1741a7cb14749a60cf85eac40e9e7d6","revision":0,"type":"bootstrap"},{"at":"2026-08-22T19:09:36Z","head":"05b9dbdcfa3b3d48804c3f0d6c643760a16ceb48","recordDigest":"1b5aca836b3c47bf02bc4b8c4c701046bf53d7fd88a51d4feaa7457f592190b2","revision":1,"type":"requirements_ready"}],"implementationAuthorization":null,"integrityDigest":"9dfb64fdaab1626aab91b8c4186daf3645ea63a5171641cec258af6d4eb55a02","lifecycle":{"acceptance":null,"blocked":null,"claim":null,"completion":null,"delivery":null,"epoch":0,"offer":null,"phase":"planning","retiredClaims":[],"writer":null},"repository":{"baseBranch":"main","baseSha":"d5f1eef459eb1598e48c9d61135d9ec7a6b10e48","identity":"github.com/KNaiFen/gkd","taskBranch":"task/r2-release-l3-host-facts","taskPath":"tasks/r2-release-l3-host-facts"},"revision":1,"schemaVersion":1,"taskId":"GKD-R2"}
