{"actionAuthorizationDigest":null,"approval":null,"documents":{"implementation":{"digest":"b87dd044f59bee4b19d6c2512b69f1eb81b8799167851aeb1c4bdae798391262","documentRevision":1,"path":"implementation.md","version":1},"plan":{"digest":"de05e44476a42f69144cf3288bcf6ac6282384aa18e0a8bc85519dcb823e6975","documentRevision":1,"materialDigest":"3ef55130f67faa194101d65c38536fef177cdae765fe706f2f82aa60dd328666","path":"plan.md","status":"proposed","version":1},"requirements":{"digest":"3273d5741c9e3393271ca6743633bf955ca85ffd7df0fc4d2b5258c3913810ad","documentRevision":1,"path":"requirements.md","status":"ready","version":1}},"history":[{"at":"2026-08-20T14:56:11Z","head":"6b5d5b78a3c5f5cc98d0659167b5d3838d14f518","recordDigest":"d8e4f70cbcc1508c6e627d309f143b30420b7551c57a2707ea6edd8e421b5eb2","revision":0,"type":"bootstrap"},{"at":"2026-08-20T14:56:20Z","head":"e74f0d48853be6438f1f509884ff6a15fc0c2657","recordDigest":"636ae496531df5c178fa484431861094e9d44f5bc6d44ecc9d4337a6cef8f1dd","revision":1,"type":"requirements_ready"}],"implementationAuthorization":null,"integrityDigest":"30062aa30c2ee13d046b2f2ca6421f457228a115d19b7edce077e0d1e934329e","lifecycle":{"acceptance":null,"blocked":null,"claim":null,"completion":null,"delivery":null,"epoch":0,"offer":null,"phase":"planning","retiredClaims":[],"writer":null},"repository":{"baseBranch":"main","baseSha":"6b5d5b78a3c5f5cc98d0659167b5d3838d14f518","identity":"github.com/KNaiFen/gkd","taskBranch":"task/m2-terminal-reclaim-bridge","taskPath":"tasks/m2-terminal-reclaim-bridge"},"revision":1,"schemaVersion":1,"taskId":"GKD-M2-F"}
