{"actionAuthorizationDigest":null,"approval":null,"documents":{"implementation":{"digest":"5267f3df7a6a59681e6614551e90c3cd68fb0d760a2f0818f2e00b446ab56839","documentRevision":1,"path":"implementation.md","version":1},"plan":{"digest":"e94a469da43693c682f9aada5d5967b961c670026927e17bb7bbe23a41b86211","documentRevision":1,"materialDigest":"03c98722d85d5e505c42cb6ce16fe4d87b64b9c3bacaf642a7a7331f75217f67","path":"plan.md","status":"proposed","version":1},"requirements":{"digest":"9665fbd46661ac1caf9c1aab1ded943da65f228bd99d1e2eff2e6bad09e0f5ad","documentRevision":1,"path":"requirements.md","status":"ready","version":1}},"history":[{"at":"2026-08-21T17:45:42Z","head":"97c97cec3aa9cf51973bf4436be4d1750e0436fc","recordDigest":"c9774428c08541afc7634ef84210f6f8512e60e415e9594060a89837e818df5b","revision":0,"type":"bootstrap"},{"at":"2026-08-21T17:45:53Z","head":"1476863032ef03f8613289edfa6355e9aafce8e9","recordDigest":"c7543bffad10b84873c384947b1a55d160c774dda47d64f365b223ffb048886d","revision":1,"type":"requirements_ready"}],"implementationAuthorization":null,"integrityDigest":"0d347cdc08e64bddfb36ae81b75058f639b6b254f5d92b4c1a54795e5a763504","lifecycle":{"acceptance":null,"blocked":null,"claim":null,"completion":null,"delivery":null,"epoch":0,"offer":null,"phase":"planning","retiredClaims":[],"writer":null},"repository":{"baseBranch":"main","baseSha":"97c97cec3aa9cf51973bf4436be4d1750e0436fc","identity":"github.com/KNaiFen/gkd","taskBranch":"task/m3-resource-scanner","taskPath":"tasks/m3-resource-scanner"},"revision":1,"schemaVersion":1,"taskId":"GKD-M3-B"}
