{"actionAuthorizationDigest":"90e07a52c238aadb29a474bd1fb3688b75450a9953a92031e5dbac4612e1cad6","approval":{"approvedAt":"2026-08-20T18:30:55Z","decisionRef":"user/continuous-gkd-m3-m4-m5/2026-08-21/GKD-M2-J","materialDigest":"6eade40c36b65e74df4a904509a2f7676ce2d3db3309fb3ad69988de0a4e20c8","planVersion":1},"documents":{"implementation":{"digest":"4c57287fc80d834bddc71e0cbe762cecc875dadc1b822c82fe899828d0bd0ba4","documentRevision":1,"path":"implementation.md","version":1},"plan":{"digest":"e29db7a284f8fd4b8e1b30929c0a33c655e8d091bc5ba43db485e7bbb396a21c","documentRevision":1,"materialDigest":"6eade40c36b65e74df4a904509a2f7676ce2d3db3309fb3ad69988de0a4e20c8","path":"plan.md","status":"approved","version":1},"requirements":{"digest":"40ee27a8705fd1dc78ca3a7ad6467f1b5cd860c19590a3a485bf6368b234bdeb","documentRevision":1,"path":"requirements.md","status":"ready","version":1}},"history":[{"at":"2026-08-20T18:30:25Z","head":"6b5d5b78a3c5f5cc98d0659167b5d3838d14f518","recordDigest":"7b561cf0911be14612efa58fe33c427be5e183b81c953a2022d91db2dd8ac771","revision":0,"type":"bootstrap"},{"at":"2026-08-20T18:30:40Z","head":"74f686ccf05ed15dbe391269c899956258606d60","recordDigest":"fed4f1b1bdc997e5a0080aed8618bc7598ac4352c449f478d8c28a53a09bd092","revision":1,"type":"requirements_ready"},{"at":"2026-08-20T18:30:55Z","head":"df579dfe17ffc86ff7d397e8dad0883b6be7a225","recordDigest":"b6a79d67a31edb1ebd78ce8e36913d189857513a1c264b0c5907ca72d126a044","revision":2,"type":"plan_approved"}],"implementationAuthorization":{"authorizedAt":"2026-08-20T18:30:55Z","decisionRef":"user/continuous-gkd-m3-m4-m5/2026-08-21/GKD-M2-J","materialDigest":"6eade40c36b65e74df4a904509a2f7676ce2d3db3309fb3ad69988de0a4e20c8","planVersion":1},"integrityDigest":"a649df00ebf18d049ea78f77cea83ff12fedd2e9140e75262a0bbe73195a9908","lifecycle":{"acceptance":null,"blocked":null,"claim":null,"completion":null,"delivery":null,"epoch":0,"offer":null,"phase":"planning","retiredClaims":[],"writer":null},"repository":{"baseBranch":"main","baseSha":"6b5d5b78a3c5f5cc98d0659167b5d3838d14f518","identity":"github.com/KNaiFen/gkd","taskBranch":"task/m2-delivery-document-contract","taskPath":"tasks/m2-delivery-document-contract"},"revision":2,"schemaVersion":1,"taskId":"GKD-M2-J"}
