{"actionAuthorizationDigest":"6b249d63984107b39d69e7714d129f2124b892078e36f6fe60f508111af5065e","approval":{"approvedAt":"2026-08-21T18:33:37Z","decisionRef":"frozen-plan-m3-c","materialDigest":"f90f3d2349f2885b1d5352f2120aa454c5ccbce98f979ba18dfc921878c29e4b","planVersion":1},"documents":{"implementation":{"digest":"9b8374f3647c162847e8929be54e0a9a72022823836c904f361adcd2b79bb65b","documentRevision":2,"path":"implementation.md","version":2},"plan":{"digest":"08e71c94caf5850834022b6e8248e89d21f77e8a8368eefe51c674babb0bc623","documentRevision":2,"materialDigest":"f90f3d2349f2885b1d5352f2120aa454c5ccbce98f979ba18dfc921878c29e4b","path":"plan.md","status":"approved","version":1},"requirements":{"digest":"11f311141a471c6457f9f3138a94ed5c9bd0154a69801811e02b5bc118f213ed","documentRevision":1,"path":"requirements.md","status":"ready","version":1}},"history":[{"at":"2026-08-21T18:32:54Z","head":"6b3f28aa8f1f1308fbb45064f5b96128837e4c4f","recordDigest":"ee10f2574cf166384c4862d6ebce1f79a81f09f579f81743796304077a1da81f","revision":0,"type":"bootstrap"},{"at":"2026-08-21T18:33:11Z","head":"2dd6572d97a8127db6609c728182b57c79304012","recordDigest":"b0bd8c5100b101526175cb37c109623f1471f3ab5156b251fceeb3268be6c08a","revision":1,"type":"requirements_ready"},{"at":"2026-08-21T18:33:19Z","head":"347cc15f0917aa083f0fbe0845ed971b5dbd5529","recordDigest":"33bfb226e0b9f0589ad749db25214bc57740199acd753a0d8cc8207aed4e1078","revision":2,"type":"plan_proposed"},{"at":"2026-08-21T18:33:37Z","head":"dc8428ade56af9f96ee761d9e75b6be5eb1693dc","recordDigest":"222ece4ec0e9d49a2ce5b5e9ac8473905789ec84916dfa2e9b5ba41189945ee4","revision":3,"type":"plan_approved"},{"at":"2026-08-21T18:34:53Z","head":"18ba29a783f3f62bf346fc4565392a26fc2416c2","recordDigest":"b47ef94f11351593baf2a4ca970d49ee1d11bbb5325f8f6a50afbd5a7f3cd7c3","revision":4,"type":"offer_created"},{"at":"2026-08-21T18:36:10Z","head":"5e4f839986cf2df15d720b050e682e0c33e73ca7","recordDigest":"a313b3d3d8cea4753217138a0de6721372a7980485a2d34efdc0e1e455674334","revision":5,"type":"claimed"}],"implementationAuthorization":{"authorizedAt":"2026-08-21T18:33:37Z","decisionRef":"frozen-plan-m3-c","materialDigest":"f90f3d2349f2885b1d5352f2120aa454c5ccbce98f979ba18dfc921878c29e4b","planVersion":1},"integrityDigest":"c7aa590315a186928aa893f0127c9fa5c8d660b8d7739d87b2666e8ee05481a1","lifecycle":{"acceptance":null,"blocked":null,"claim":{"activationId":"7758ff0078489dd8d38aab1052b579ac2d1db0c9246353ee4d9215a57787256e","claimBaseHead":"5e4f839986cf2df15d720b050e682e0c33e73ca7","claimId":"e7af0e81458cc49a4a0a55210b79eebc76e2c06c6f3f6d046f74724904b2a707","claimedAt":"2026-08-21T18:36:10Z","configDigest":"10c0675808974609242280367f2e7aea07e61dd839a1ec2e244d53a9b6c74e3e","envelopeId":"e30d8f31992d2f6290abd79ea218ad0f97bb37152773f95eb35691a1d10e24f3","epoch":0,"executionBundleDigest":"5f68703a42df613125814d78a491cb1991620afcb915d5a486c6ea6334604129","offerId":"d69bf7e5ca0a76a05e9a95cbf09737666316cca9d371f85df40e28454e37d97a","roleDigest":"e21916be7aa65313cf83dda521850a8f91d746e520b240356f9a08232cfae29a","routeDecisionDigest":"70376b685e04318e2ab761d4a4ec3f1640105aaaac3424b5d41864ec4174426c","sessionDigest":"46fc73c9266ef2478757b23ced479126bab744b8bb06eca7c58aedeb2451ff71","writerId":"gkd_executor_gkd_m3_c_2ffb527759e1d8bb23c31170b33c2a3ec7dbde72fa77d36aa23fc6175a3e3f11"},"completion":null,"delivery":null,"epoch":0,"offer":{"authorizationDigest":"6b249d63984107b39d69e7714d129f2124b892078e36f6fe60f508111af5065e","epoch":0,"offerId":"d69bf7e5ca0a76a05e9a95cbf09737666316cca9d371f85df40e28454e37d97a"},"phase":"implementing","retiredClaims":[],"writer":{"claimId":"e7af0e81458cc49a4a0a55210b79eebc76e2c06c6f3f6d046f74724904b2a707","sessionDigest":"46fc73c9266ef2478757b23ced479126bab744b8bb06eca7c58aedeb2451ff71","writerId":"gkd_executor_gkd_m3_c_2ffb527759e1d8bb23c31170b33c2a3ec7dbde72fa77d36aa23fc6175a3e3f11"}},"repository":{"baseBranch":"main","baseSha":"6b3f28aa8f1f1308fbb45064f5b96128837e4c4f","identity":"github.com/KNaiFen/gkd","taskBranch":"task/m3-review-skills","taskPath":"tasks/m3-review-skills"},"revision":5,"schemaVersion":1,"taskId":"GKD-M3-C"}
