{"actionAuthorizationDigest":"92df1ca5f0717c6d5c0f9310e0be0fcd33710add88f165ade03017a91c6ad7b9","approval":{"approvedAt":"2026-08-20T17:42:56Z","decisionRef":"user/continuous-gkd-m3-m4-m5/2026-08-21/GKD-M2-I","materialDigest":"3ef55130f67faa194101d65c38536fef177cdae765fe706f2f82aa60dd328666","planVersion":1},"documents":{"implementation":{"digest":"d35dedb4b0ef30acc5f9205d54adb19235d0c90a6e0d95df740ad0589ba74eeb","documentRevision":1,"path":"implementation.md","version":1},"plan":{"digest":"cb5f14189aefe1dd77aebd8a65a719345272cc05c622cf1eb16c9358d7c0b674","documentRevision":1,"materialDigest":"3ef55130f67faa194101d65c38536fef177cdae765fe706f2f82aa60dd328666","path":"plan.md","status":"approved","version":1},"requirements":{"digest":"4f1d18d1bb5cd2b096b66bba70b75e516b367ff9d97751129b52bbe18de7666e","documentRevision":1,"path":"requirements.md","status":"ready","version":1}},"history":[{"at":"2026-08-20T17:41:03Z","head":"6b5d5b78a3c5f5cc98d0659167b5d3838d14f518","recordDigest":"5953c7394ca5d8d5f732c11ba8e38f99e84343d21fc12cba7a46c08d311347a0","revision":0,"type":"bootstrap"},{"at":"2026-08-20T17:42:42Z","head":"6e2340d9548b18d9768150fd4774686ddf3c16ea","recordDigest":"09bd7c7bbce373aee683034329e3f7a682bb17bc084007068ccda776e67f1ddc","revision":1,"type":"requirements_ready"},{"at":"2026-08-20T17:42:56Z","head":"fa7fe5368aa9d82d0000ebf245ef2629c22a5d41","recordDigest":"2554f83495d3e314a6610f4b9ddec6c8ee714192a4cef8591035a4eacc26673f","revision":2,"type":"plan_approved"},{"at":"2026-08-20T17:43:32Z","head":"9f6d08be698cb12e646a6cc280b149c2acc2f85c","recordDigest":"f99d86e955a13e18550610a925d7bfad4bec44fc85b3c811e941c682e8b9d4ea","revision":3,"type":"offer_created"}],"implementationAuthorization":{"authorizedAt":"2026-08-20T17:42:56Z","decisionRef":"user/continuous-gkd-m3-m4-m5/2026-08-21/GKD-M2-I","materialDigest":"3ef55130f67faa194101d65c38536fef177cdae765fe706f2f82aa60dd328666","planVersion":1},"integrityDigest":"8cd397a22ceb035c09486039b4baa9b9c228d6223e9d46b4164c3ad081054d12","lifecycle":{"acceptance":null,"blocked":null,"claim":null,"completion":null,"delivery":null,"epoch":0,"offer":{"authorizationDigest":"92df1ca5f0717c6d5c0f9310e0be0fcd33710add88f165ade03017a91c6ad7b9","epoch":0,"offerId":"c0b0e92ea02dcf1d4a4749f63b98adf27710c59d5a8b06c1b4a52dbf63e44149"},"phase":"awaiting_claim","retiredClaims":[],"writer":null},"repository":{"baseBranch":"main","baseSha":"6b5d5b78a3c5f5cc98d0659167b5d3838d14f518","identity":"github.com/KNaiFen/gkd","taskBranch":"task/m2-host-recovery-bridge-live","taskPath":"tasks/m2-host-recovery-bridge-live"},"revision":3,"schemaVersion":1,"taskId":"GKD-M2-I"}
