{"actionAuthorizationDigest":"0a0820a7b31288a182e4e9270c5a20e938e065ead030306da235ce7847407beb","approval":{"approvedAt":"2026-08-20T15:03:19Z","decisionRef":"user/continuous-gkd-m3-m4-m5/2026-08-20/GKD-M2-G","materialDigest":"3ef55130f67faa194101d65c38536fef177cdae765fe706f2f82aa60dd328666","planVersion":1},"documents":{"implementation":{"digest":"e4790f6d4ec03497e47df8ed7ef39f56225fb86265fc4208ea727e63e89f3c20","documentRevision":1,"path":"implementation.md","version":1},"plan":{"digest":"31aa51728570a6986ea10094c0dd20ce2b19d2f35eb87cb85a175b555aec870b","documentRevision":1,"materialDigest":"3ef55130f67faa194101d65c38536fef177cdae765fe706f2f82aa60dd328666","path":"plan.md","status":"approved","version":1},"requirements":{"digest":"5aa382fb582abbb2d2502588bee371fc5345c63dd75793eddffe329e162ec50a","documentRevision":1,"path":"requirements.md","status":"ready","version":1}},"history":[{"at":"2026-08-20T15:02:59Z","head":"6b5d5b78a3c5f5cc98d0659167b5d3838d14f518","recordDigest":"aeeecaf849f5f5b6f40fc325b9f20ec0d18e2d5cbecfc2047b6dd249e37a1196","revision":0,"type":"bootstrap"},{"at":"2026-08-20T15:03:08Z","head":"2dd5c27339744274498bdb905004e11058ad48f6","recordDigest":"0fbeb3e6d6986fc725dbe8a4e7e0f37f0d6d31c5f06f02a48434cdfe8e3ca523","revision":1,"type":"requirements_ready"},{"at":"2026-08-20T15:03:19Z","head":"64faa465fbeed96e581e18bf90a28efaa50151cb","recordDigest":"05dadb0605bcc4034334571765aa231340968bfd58bc79bfe88248d09ba8b054","revision":2,"type":"plan_approved"},{"at":"2026-08-20T15:03:48Z","head":"d233c6aa258f9de2244e0da79b19eb39f2a3a410","recordDigest":"a19b937ddc0cf9ab4dc2e4da057ac18a4138bc80bb4a8bff88498447d311ed3a","revision":3,"type":"offer_created"}],"implementationAuthorization":{"authorizedAt":"2026-08-20T15:03:19Z","decisionRef":"user/continuous-gkd-m3-m4-m5/2026-08-20/GKD-M2-G","materialDigest":"3ef55130f67faa194101d65c38536fef177cdae765fe706f2f82aa60dd328666","planVersion":1},"integrityDigest":"cc338e253a480bf256a5a5cded641dc2d2903453fc92189f8f67372080eca445","lifecycle":{"acceptance":null,"blocked":null,"claim":null,"completion":null,"delivery":null,"epoch":0,"offer":{"authorizationDigest":"0a0820a7b31288a182e4e9270c5a20e938e065ead030306da235ce7847407beb","epoch":0,"offerId":"e596f584a9a4ff07a19862536a2a7a0237e5df008006b96c47e416d8efc3a1b9"},"phase":"awaiting_claim","retiredClaims":[],"writer":null},"repository":{"baseBranch":"main","baseSha":"6b5d5b78a3c5f5cc98d0659167b5d3838d14f518","identity":"github.com/KNaiFen/gkd","taskBranch":"task/m2-host-recovery-bridge","taskPath":"tasks/m2-host-recovery-bridge"},"revision":3,"schemaVersion":1,"taskId":"GKD-M2-G"}
