{"actionAuthorizationDigest":null,"approval":null,"documents":{"implementation":{"digest":"a2377d1980b1f854b774fdc37d380d8b6254d01681a8818b51789e1cae375321","documentRevision":1,"path":"implementation.md","version":1},"plan":{"digest":"3c8cbbe97756caf12368d3a16b06c9d3a2418d04279f810c40e1ea9ac95b7cde","documentRevision":1,"materialDigest":"6326055e1023af30e02f46ca68f5b516790e7925cd2e9ff88429a3423bcd1945","path":"plan.md","status":"proposed","version":1},"requirements":{"digest":"c47dedda0ff0c1817d10cc15d3e52052ac584687152ab963068fd812505da593","documentRevision":1,"path":"requirements.md","status":"draft","version":1}},"history":[{"at":"2026-08-22T18:29:37Z","head":"2d848db56aad86ece5daba281b7f857c6c1f82c6","recordDigest":"528a9a129380d1ab14e1206242ae8aeb99de5b7c340f458f3d395e2bf202a80d","revision":0,"type":"bootstrap"}],"implementationAuthorization":null,"integrityDigest":"4190e60d9c921863cc0247f0b4d52472e83387f7425dac765d1c408717fde8e9","lifecycle":{"acceptance":null,"blocked":null,"claim":null,"completion":null,"delivery":null,"epoch":0,"offer":null,"phase":"planning","retiredClaims":[],"writer":null},"repository":{"baseBranch":"main","baseSha":"2d848db56aad86ece5daba281b7f857c6c1f82c6","identity":"github.com/KNaiFen/gkd","taskBranch":"task/r1-versioned-release-upgrade","taskPath":"tasks/r1-versioned-release-upgrade"},"revision":0,"schemaVersion":1,"taskId":"GKD-R1"}
