{"actionAuthorizationDigest":"f9eef4275e35c2df5bd1f43abbbc115d039e0253ef8746802a9c4d5189449aa2","approval":{"approvedAt":"2026-08-22T20:02:22Z","decisionRef":"2026-08-23-user-authorization","materialDigest":"c2a583e39a21e9edd347f72573c8514dcd954f286e34917545bb87dd6f22c377","planVersion":1},"documents":{"implementation":{"digest":"476a3095c011dd86ee1cdd73da0dce0c7d6067ca6972fb134d6e9b60533ca86a","documentRevision":3,"path":"implementation.md","version":3},"plan":{"digest":"8c0fe48ae38aa7ff683e4e0a499edb0cc91fb536532bd34e52bae677d8fee02c","documentRevision":3,"materialDigest":"c2a583e39a21e9edd347f72573c8514dcd954f286e34917545bb87dd6f22c377","path":"plan.md","status":"approved","version":1},"requirements":{"digest":"5156531cdcb79fc8604350b213e7b902e8556c1e9a9b65019e30fd14dc6e714f","documentRevision":1,"path":"requirements.md","status":"ready","version":1}},"history":[{"at":"2026-08-22T20:01:30Z","head":"d277a8c43747853359094b0bb1538dee0d00a708","recordDigest":"19746fd5c5401fdd7cd25204395500091a0b919e075a4ffb8d0cf63df5690594","revision":0,"type":"bootstrap"},{"at":"2026-08-22T20:01:49Z","head":"8ce98e28faef7487a447dd82c1fe9542e252b73f","recordDigest":"7c8295dc50b13c992b953b5693bda280a2daa1605ca68f5d938480f4f471ba63","revision":1,"type":"requirements_ready"},{"at":"2026-08-22T20:02:05Z","head":"ebcac3eaae1a6845b89997cd559749c85d54a2cc","recordDigest":"4ead12a0ff94910761aa1f295789c2daadd9ada2b0615508f7e79580d9597d40","revision":2,"type":"plan_proposed"},{"at":"2026-08-22T20:02:22Z","head":"ed6cb78bb890a50b856b9a718fce85f220f806a1","recordDigest":"c02603d7c6a74eaed120f761f396ada22f43c96fdd7336ad06974ea0fb3787ea","revision":3,"type":"plan_approved"},{"at":"2026-08-22T20:05:46Z","head":"bd3c24d0742d8f3543b5f10f2899bd62c816edc4","recordDigest":"6c966155158d75d3d08fa0fa56b54c71d8b3cb44153c1bb2616b9cc1d5a0a6de","revision":4,"type":"plan_proposed"}],"implementationAuthorization":{"authorizedAt":"2026-08-22T20:02:22Z","decisionRef":"2026-08-23-user-authorization","materialDigest":"c2a583e39a21e9edd347f72573c8514dcd954f286e34917545bb87dd6f22c377","planVersion":1},"integrityDigest":"0c37f0d6d4fe2e1474f191ffd4ed046ef50fc764f39b63fedfa6f3209294afd4","lifecycle":{"acceptance":null,"blocked":null,"claim":null,"completion":null,"delivery":null,"epoch":0,"offer":null,"phase":"planning","retiredClaims":[],"writer":null},"repository":{"baseBranch":"main","baseSha":"d277a8c43747853359094b0bb1538dee0d00a708","identity":"github.com/KNaiFen/gkd","taskBranch":"task/r3-consumer-policy-binding","taskPath":"tasks/r3-consumer-policy-binding"},"revision":4,"schemaVersion":1,"taskId":"GKD-R3"}
