{"actionAuthorizationDigest":"0539354c0d8e37e5f502f11049f3104e8137f0beb8e356289e97ffcc51b885d0","approval":{"approvedAt":"2026-08-22T09:00:12Z","decisionRef":"frozen-plan-m5-c-cross-repository-final-gate","materialDigest":"77d0342aed1bf04e38606b3ecd59ea084c6b9be957ee91a006f6ece2acb34cf7","planVersion":1},"documents":{"implementation":{"digest":"6f70a7da2132ea844c73751b6634367c929fa9965c87e8221a30bd5cc83ca018","documentRevision":2,"path":"implementation.md","version":2},"plan":{"digest":"9c7c0a04837b06922acb9bc1d0b8cb3a55adf13721d9271521539304c17a496d","documentRevision":2,"materialDigest":"77d0342aed1bf04e38606b3ecd59ea084c6b9be957ee91a006f6ece2acb34cf7","path":"plan.md","status":"approved","version":1},"requirements":{"digest":"f4a9e28d34cb1a5c866e17b32a102069909fe856ca874406363a1e10b6251127","documentRevision":1,"path":"requirements.md","status":"ready","version":1}},"history":[{"at":"2026-08-22T08:59:39Z","head":"c1de724d686af291cb1ffcf0a2cb12d6621244c6","recordDigest":"dbb3918c02ef94026c554557c980f5630fb23b487f0a3ce17268db554e046275","revision":0,"type":"bootstrap"},{"at":"2026-08-22T08:59:46Z","head":"88e8207078c79449df9ab24519685a9d9dc1f727","recordDigest":"bf4ab0ade0dbe7e239f79e1447b0fc6a48b213db0430492a6384c552a0334b06","revision":1,"type":"requirements_ready"},{"at":"2026-08-22T09:00:04Z","head":"660e8eb685a17445586fb6c0416875871ec1f1ff","recordDigest":"e68c76deca64e2de4377326190dcfffb5cc0e670cd52391ab2f348740759ebea","revision":2,"type":"plan_proposed"},{"at":"2026-08-22T09:00:12Z","head":"c449b2efa9fc9fa0a2d779c1aa9b16e85dc4ee06","recordDigest":"cd41febbb3eef359367fac337e271ae337c28b56f03e09a9dd5bc6c87103ca13","revision":3,"type":"plan_approved"},{"at":"2026-08-22T09:00:34Z","head":"67a063b81693ff480a0831c55e47bfb6e9e04213","recordDigest":"d441e24b17db09d31ec27d7bf5a55237e46472aa9a16e4384e4c555382fe1625","revision":4,"type":"offer_created"},{"at":"2026-08-22T09:01:14Z","head":"b6c07891e65eee3a7f4b10fd3b21bd46e65c3201","recordDigest":"422e9730cc2696b0fefb4a71f95268c1db8119712db23c22413e43aa265b2853","revision":5,"type":"claimed"},{"at":"2026-08-22T09:02:22Z","head":"4ad1753a02b31f3205b6c96b68583b1ec2dc21ac","recordDigest":"c2ceb5fd1c859a3ba6b806bf73af2cd4340b5d83a489129baa42c945364fbb1f","revision":6,"type":"reclaimed"},{"at":"2026-08-22T09:02:36Z","head":"d246891c8f15d6ae914993a2da9a34e2d0fcfb69","recordDigest":"2787ea626d1cf5e3ee152f21318b4f7fa2687b65606318ab78fc6d99430b0027","revision":7,"type":"offer_created"},{"at":"2026-08-22T09:03:20Z","head":"4c79c5edaf8fc3b89a4c6cbe783e7d68124119e7","recordDigest":"f0494efe7692e2432cb78dad5a283cff81fbd4ec0728ac7cab23b8b30297617b","revision":8,"type":"claimed"}],"implementationAuthorization":{"authorizedAt":"2026-08-22T09:00:12Z","decisionRef":"frozen-plan-m5-c-cross-repository-final-gate","materialDigest":"77d0342aed1bf04e38606b3ecd59ea084c6b9be957ee91a006f6ece2acb34cf7","planVersion":1},"integrityDigest":"278a42dc72df7b2f622773c8c0e64a629f54c03ec39e5a850682931c3ee080c5","lifecycle":{"acceptance":null,"blocked":null,"claim":{"activationId":"dd9a4941f978631314338ed8d8985051ee8ae9268d0174e83272e0a761b80282","claimBaseHead":"4c79c5edaf8fc3b89a4c6cbe783e7d68124119e7","claimId":"b43b85d1c7dcdddd86fb80afd54d58501e283febc0e2981eeda88d5fdca3d28b","claimedAt":"2026-08-22T09:03:20Z","configDigest":"d44d2286d0a01a7b0f82610c02a6ada9fb1dc74f05730b1e8629f784d68595d2","envelopeId":"cfe55dd1745b9d1a56a7178c044199b02a83591e76d8a065b1d42c187a95e9d4","epoch":1,"executionBundleDigest":"27470fc60cfa005a2784ac81f0aba07c4e50e2381bf057fe9b38aa8d016e1912","offerId":"b7dc2a7d93a7a134550f77775b04e527c2d585b45ff53d365a073b1289bf49a6","roleDigest":"b7660cee9bdab5b1011ae9e92a2a817536f508ef1475a10cc53acd9a1d99c25b","routeDecisionDigest":"a298f65210f9b163633bb3043491231020a2f3754d0ea2285e1e859c87ce01a4","sessionDigest":"7ff16f2284b4c76d33924650371e65746a51e730e203af6d50386441c7619165","writerId":"gkd_executor_gkd_m5_c_7a517cc8894b1764fe8b512a8cfd91aef178c94b105af4b1e24cf1bf17b39c6a"},"completion":null,"delivery":null,"epoch":1,"offer":{"authorizationDigest":"0539354c0d8e37e5f502f11049f3104e8137f0beb8e356289e97ffcc51b885d0","epoch":1,"offerId":"b7dc2a7d93a7a134550f77775b04e527c2d585b45ff53d365a073b1289bf49a6"},"phase":"implementing","retiredClaims":[{"claim":{"activationId":"923f313a2256aaba8c27f507f3dda68580eee7b506aa8d84d3d4f360283adfe6","claimBaseHead":"b6c07891e65eee3a7f4b10fd3b21bd46e65c3201","claimId":"3901b66df8f943c28985cbd15e0173b74fbcefe7ea372eac0c8c52b5c09bb013","claimedAt":"2026-08-22T09:01:14Z","configDigest":"d44d2286d0a01a7b0f82610c02a6ada9fb1dc74f05730b1e8629f784d68595d2","envelopeId":"ec4a72b73201f4614945b736ca68cdfbaf96f9df59599fe8ecc7331e07f11842","epoch":0,"executionBundleDigest":"27470fc60cfa005a2784ac81f0aba07c4e50e2381bf057fe9b38aa8d016e1912","offerId":"83b098cbae95cbad6a8dd9ca75b7f00eacec3f5e1fd5712270de1c852a6a2e44","roleDigest":"b7660cee9bdab5b1011ae9e92a2a817536f508ef1475a10cc53acd9a1d99c25b","routeDecisionDigest":"a298f65210f9b163633bb3043491231020a2f3754d0ea2285e1e859c87ce01a4","sessionDigest":"03d1631cd331d2b98d0739c6f6e1414223fc518e1cc6de7ccd7b1cf083a8d469","writerId":"gkd_executor_gkd_m5_c_d716c0b811f0e33382508806724e58b4799da05420cd2304e2978a27c98df423"},"epoch":0,"offerId":"83b098cbae95cbad6a8dd9ca75b7f00eacec3f5e1fd5712270de1c852a6a2e44","reason":"host-terminal","retiredAt":"2026-08-22T09:02:22Z"}],"writer":{"claimId":"b43b85d1c7dcdddd86fb80afd54d58501e283febc0e2981eeda88d5fdca3d28b","sessionDigest":"7ff16f2284b4c76d33924650371e65746a51e730e203af6d50386441c7619165","writerId":"gkd_executor_gkd_m5_c_7a517cc8894b1764fe8b512a8cfd91aef178c94b105af4b1e24cf1bf17b39c6a"}},"repository":{"baseBranch":"main","baseSha":"c1de724d686af291cb1ffcf0a2cb12d6621244c6","identity":"github.com/KNaiFen/gkd","taskBranch":"task/m5-cross-repo-gate","taskPath":"tasks/m5-cross-repo-gate"},"revision":8,"schemaVersion":1,"taskId":"GKD-M5-C"}
