{"actionAuthorizationDigest":null,"approval":null,"documents":{"implementation":{"digest":"0e951297a3d56ca20e0e346fd0a5f8a4c18b49008ec9fac0ac6c02edaba1b7e1","documentRevision":1,"path":"implementation.md","version":1},"plan":{"digest":"65fdc453be847902c40fda9432c0310b96292384a8719c4a436ee7efe0347f48","documentRevision":1,"materialDigest":"9284d2392ba640f94aef59a5d0b78e6d864c1a4ddbdabe026be36f4f55d91dfc","path":"plan.md","status":"proposed","version":1},"requirements":{"digest":"061a367ed70644878cf817cac13430f15b9ae04280aab8dc3100bc2dad33613d","documentRevision":1,"path":"requirements.md","status":"draft","version":1}},"history":[{"at":"2026-08-22T17:11:40Z","head":"d093113f2252a322956cc4f9dae2067be51d33a2","recordDigest":"fab29e584490d85de77e0b88f36d9c0dae5278ff5c959d6e8ed8ee4fe043b41b","revision":0,"type":"bootstrap"}],"implementationAuthorization":null,"integrityDigest":"e35319d98472d3a5ad2f859f4d8f5d9d43aea567a1cd52000fadde420df27cc6","lifecycle":{"acceptance":null,"blocked":null,"claim":null,"completion":null,"delivery":null,"epoch":0,"offer":null,"phase":"planning","retiredClaims":[],"writer":null},"repository":{"baseBranch":"main","baseSha":"d093113f2252a322956cc4f9dae2067be51d33a2","identity":"github.com/KNaiFen/gkd","taskBranch":"task/m2-k-host-spawn-acknowledgement","taskPath":"tasks/m2-host-spawn-acknowledgement"},"revision":0,"schemaVersion":1,"taskId":"GKD-M2-K"}
